{
  "$id": "bureau_episode_script_v1.schema.json", "$schema": "https://json-schema.org/draft/2020-12/schema",
  "type": "object", "additionalProperties": false,
  "required": ["schema_version", "artifact_type", "artifact_id", "property_id", "episode_id", "created_at", "generator_version", "upstream_artifacts", "title", "hook_options", "selected_hook", "traveler_promise", "setup", "impossible_rule", "instructions", "escalation", "institutional_contradiction", "reveal", "closing_line", "bureau_sign_off", "narration_segments", "pronunciation_notes", "user_revisions", "timing_estimate_ms", "semantic_continuity_references"],
  "properties": {
    "schema_version": {"$ref": "common_defs_v1.schema.json#/$defs/schema_version"}, "artifact_type": {"const": "bureau_episode_script_v1"}, "artifact_id": {"$ref": "common_defs_v1.schema.json#/$defs/artifact_id"}, "property_id": {"$ref": "common_defs_v1.schema.json#/$defs/property_id"}, "episode_id": {"$ref": "common_defs_v1.schema.json#/$defs/episode_id"}, "created_at": {"$ref": "common_defs_v1.schema.json#/$defs/created_at"}, "generator_version": {"$ref": "common_defs_v1.schema.json#/$defs/generator_version"}, "upstream_artifacts": {"$ref": "common_defs_v1.schema.json#/$defs/upstream_artifacts"},
    "title": {"$ref": "common_defs_v1.schema.json#/$defs/nonempty_string"}, "hook_options": {"type": "array", "items": {"$ref": "common_defs_v1.schema.json#/$defs/nonempty_string"}, "minItems": 2, "maxItems": 8, "uniqueItems": true}, "selected_hook": {"$ref": "common_defs_v1.schema.json#/$defs/nonempty_string"}, "traveler_promise": {"$ref": "common_defs_v1.schema.json#/$defs/nonempty_string"}, "setup": {"$ref": "common_defs_v1.schema.json#/$defs/nonempty_string"}, "impossible_rule": {"$ref": "common_defs_v1.schema.json#/$defs/nonempty_string"}, "instructions": {"type": "array", "items": {"$ref": "common_defs_v1.schema.json#/$defs/nonempty_string"}, "minItems": 3, "maxItems": 8}, "escalation": {"$ref": "common_defs_v1.schema.json#/$defs/nonempty_string"}, "institutional_contradiction": {"$ref": "common_defs_v1.schema.json#/$defs/nonempty_string"}, "reveal": {"$ref": "common_defs_v1.schema.json#/$defs/nonempty_string"}, "closing_line": {"$ref": "common_defs_v1.schema.json#/$defs/nonempty_string"}, "bureau_sign_off": {"$ref": "common_defs_v1.schema.json#/$defs/nonempty_string"},
    "narration_segments": {"type": "array", "minItems": 7, "maxItems": 20, "items": {"type": "object", "additionalProperties": false, "required": ["segment_id", "text", "duration_ms", "caption_safe"], "properties": {"segment_id": {"$ref": "common_defs_v1.schema.json#/$defs/slug"}, "text": {"$ref": "common_defs_v1.schema.json#/$defs/nonempty_string"}, "duration_ms": {"type": "integer", "minimum": 1000, "maximum": 12000}, "caption_safe": {"const": true}}}},
    "pronunciation_notes": {"type": "array", "items": {"$ref": "common_defs_v1.schema.json#/$defs/nonempty_string"}, "maxItems": 30}, "user_revisions": {"type": "array", "items": {"$ref": "common_defs_v1.schema.json#/$defs/nonempty_string"}, "maxItems": 30}, "timing_estimate_ms": {"type": "integer", "minimum": 45000, "maximum": 60000}, "semantic_continuity_references": {"$ref": "common_defs_v1.schema.json#/$defs/tag_list"}
  }
}
